{
  "$schema": "https://json-schema.org/draft/2019-09/schema",
  "$id": "ancestry.schema.json-2.0.0",
  "title": "Draw Steel Ancestry",
  "description": "BETA — subject to change without notice. A hero ancestry for Draw Steel, including signature trait and purchasable traits.",
  "type": "object",
  "required": ["name", "type"],
  "unevaluatedProperties": false,
  "properties": {
    "name": {
      "type": "string",
      "description": "The name of the ancestry (e.g., \"Human\", \"Hakaan\", \"Memonek\")."
    },
    "type": {
      "const": "ancestry",
      "description": "Must always be 'ancestry'."
    },
    "scc": {
      "type": "string",
      "description": "Steel Compendium Classification (SCC) code — the API key and site permalink for this entity (see the SCC scheme spec). Omitted on hand-authored homebrew content that hasn't been classified."
    },
    "flavor": {
      "type": "string",
      "description": "Narrative description of the ancestry."
    },
    "signature_trait_name": {
      "type": "string",
      "description": "The name of the ancestry's signature trait (e.g., \"Detect the Supernatural\")."
    },
    "signature_trait_description": {
      "type": "string",
      "description": "Full text of the signature trait's effect."
    },
    "ancestry_points": {
      "type": "integer",
      "minimum": 1,
      "description": "Number of ancestry points available to spend on purchased traits (3 in core rules)."
    },
    "purchased_traits": {
      "type": "array",
      "items": { "$ref": "#/$defs/AncestryTrait" },
      "description": "Traits available for purchase with ancestry points."
    },
    "content": {
      "type": "string",
      "description": "Raw markdown body of the ancestry description."
    },
    "metadata": {
      "type": "object",
      "description": "Additional metadata (SCC, source, etc.).",
      "additionalProperties": true
    }
  },
  "$defs": {
    "AncestryTrait": {
      "type": "object",
      "required": ["name", "cost"],
      "unevaluatedProperties": false,
      "properties": {
        "name": {
          "type": "string",
          "description": "The name of the trait (e.g., \"Perseverance\", \"Staying Power\")."
        },
        "cost": {
          "type": "integer",
          "minimum": 1,
          "description": "Ancestry point cost (e.g., 1, 2, 3)."
        },
        "description": {
          "type": "string",
          "description": "Full text of the trait's effect."
        }
      }
    }
  }
}
